first_name,age,password,phone_number,image,intrests,hobbies, lifestyle
Lital, 25, Password1234, 555-1234, userPhoto/lital.jpg, Jogging, Yapping, rest
Karolina, 30, SecurePass987, 555-5678, userPhoto/karolina.jpeg, Jogging, Yapping, rest
Mike, 28, StrongWord789, 555-1357, image_3.jpg, Fitness, Cooking, Creative
Sarah, 34, MightyCode456, 555-2468, image_4.jpg, Fashion, Yoga, Career-Focused
David, 42, QuickStep901, 555-7890, image_5.jpg, Sports, Fishing, Calm
Emma, 23, SafePlace234, 555-3141, image_6.jpg, Music, Reading, Minimalist
Chris, 27, PasswordB678, 555-5313, userPhoto/Tameer.jpeg, Nature, Photography, Eco-friendly
Olivia, 35, StartAgain843, 555-1415, image_8.jpg, Arts, Hiking, Spiritual
Matt, 29, PassItUp555, 555-1617, image_9.jpg, Technology, Gaming, Active
Sophia, 26, TopSecret123, 555-1819, image_10.jpg, Science, Dancing, Family-Oriented
Daniel, 31, HighRoad967, 555-2020, image_11.jpg, Travel, Photography, Adventurous
Isabella, 28, BoldMove789, 555-2122, image_12.jpg, Fitness, Cooking, Creative
James, 33, SecurePath567, 555-2323, image_13.jpg, Literature, Painting, Social
Ava, 21, PrimeKey234, 555-2424, image_14.jpg, Science, Yoga, Minimalist
Liam, 36, StrongPoint852, 555-2525, image_15.jpg, Arts, Traveling, Eco-friendly
Mia, 24, SecureMove921, 555-2626, image_16.jpg, Fashion, Dancing, Career-Focused
Jacob, 40, SafeJourney124, 555-2727, image_17.jpg, Nature, Hiking, Adventurous
Zoe, 19, NextLevel765, 555-2828, image_18.jpg, Music, Gaming, Creative
Lucas, 38, AlphaWord998, 555-2929, image_19.jpg, Sports, Fishing, Calm
Amelia, 22, BrightFuture123, 555-3030, image_20.jpg, Fitness, Photography, Spiritual
Ethan, 37, NewStart567, 555-3131, image_21.jpg, Technology, Painting, Active
Charlotte, 30, KeyLife789, 555-3232, image_22.jpg, Literature, Cooking, Family-Oriented
Noah, 26, SafeStep123, 555-3333, image_23.jpg, Travel, Yoga, Career-Focused
Harper, 27, PassGuard910, 555-3434, image_24.jpg, Fashion, Dancing, Social
Alexander, 45, SecureSpot879, 555-3535, image_25.jpg, Science, Gaming, Eco-friendly
Ella, 32, HighPass521, 555-3636, image_26.jpg, Fitness, Fishing, Spiritual
Benjamin, 22, BrightWay762, 555-3737, image_27.jpg, Nature, Photography, Adventurous
Grace, 28, MightyMind987, 555-3838, image_28.jpg, Music, Reading, Creative
Henry, 29, TopLevel321, 555-3939, image_29.jpg, Technology, Hiking, Minimalist
Lily, 35, AlphaSafe654,05352085987, image_30.jpg, Literature, Traveling, Active
,,,,